{
  "$schema": "https://json-schema.org/draft/2020-12/schema",
  "$id": "https://metaviewer.local/contracts/v0.2/envelope.schema.json",
  "title": "Envelope",
  "type": "object",
  "properties": {
    "schema": {
      "const": "envelope/v0.2"
    },
    "msg_id": {
      "type": "string",
      "minLength": 1,
      "maxLength": 128
    },
    "ts_ns": {
      "type": "integer",
      "minimum": 0,
      "maximum": 9007199254740991
    },
    "from": {
      "type": "object",
      "properties": {
        "component": {
          "type": "string",
          "enum": [
            "core",
            "ui",
            "daemon",
            "agent",
            "vision",
            "wender"
          ],
          "maxLength": 65536
        },
        "instance": {
          "type": "string",
          "minLength": 1,
          "maxLength": 128
        }
      },
      "required": [
        "component",
        "instance"
      ],
      "additionalProperties": false,
      "maxProperties": 256
    },
    "to": {
      "type": "object",
      "properties": {
        "component": {
          "type": "string",
          "enum": [
            "core",
            "ui",
            "daemon",
            "agent",
            "vision",
            "wender"
          ],
          "maxLength": 65536
        },
        "instance": {
          "type": "string",
          "minLength": 1,
          "maxLength": 128
        }
      },
      "required": [
        "component",
        "instance"
      ],
      "additionalProperties": false,
      "maxProperties": 256
    },
    "session_id": {
      "type": "string",
      "minLength": 1,
      "maxLength": 128
    },
    "seq": {
      "type": "integer",
      "minimum": 1,
      "maximum": 9007199254740991
    },
    "nonce": {
      "type": "string",
      "minLength": 1,
      "maxLength": 128
    },
    "body": {
      "oneOf": [
        {
          "$ref": "surface.schema.json"
        },
        {
          "$ref": "frame_ref.schema.json"
        },
        {
          "$ref": "surface_request.schema.json"
        },
        {
          "$ref": "surface_event.schema.json"
        },
        {
          "$ref": "observation.schema.json"
        },
        {
          "$ref": "action_proposal.schema.json"
        },
        {
          "$ref": "action_verdict.schema.json"
        },
        {
          "$ref": "action_receipt.schema.json"
        },
        {
          "$ref": "hello.schema.json"
        },
        {
          "$ref": "capsule_meta.schema.json"
        },
        {
          "$ref": "ui_intent.schema.json"
        },
        {
          "$ref": "catalog_entry.schema.json"
        },
        {
          "$ref": "terminal_session.schema.json"
        },
        {
          "$ref": "record_request.schema.json"
        },
        {
          "$ref": "record_event.schema.json"
        },
        {
          "$ref": "settings.schema.json"
        },
        {
          "$ref": "mv_tool_call.schema.json"
        },
        {
          "$ref": "mv_tool_result.schema.json"
        },
        {
          "$ref": "session_record.schema.json"
        }
      ]
    }
  },
  "required": [
    "schema",
    "msg_id",
    "ts_ns",
    "from",
    "to",
    "session_id",
    "seq",
    "nonce",
    "body"
  ],
  "additionalProperties": false,
  "maxProperties": 256
}
