{
  "schema": "envelope/v0.2",
  "msg_id": "x",
  "ts_ns": 0,
  "from": {
    "component": "core",
    "instance": "x"
  },
  "to": {
    "component": "core",
    "instance": "x"
  },
  "session_id": "x",
  "seq": 1,
  "nonce": "x",
  "body": {
    "schema": "mv_tool_result/v0.2",
    "request_id": "x",
    "op": "observe",
    "status": "refused",
    "reason_code": "OUT_OF_BOUNDS",
    "detail": "x"
  }
}
