{
  "schema": "envelope/v0.2",
  "msg_id": "x",
  "ts_ns": 0,
  "from": {
    "component": "core",
    "instance": "x"
  },
  "to": {
    "component": "core",
    "instance": "x"
  },
  "session_id": "x",
  "seq": 1,
  "nonce": "x",
  "body": {
    "schema": "surface_request/v0.2",
    "op": "create",
    "params": {
      "kind": "vm",
      "geometry": {
        "w": 1,
        "h": 1
      },
      "profile_id": "x"
    }
  }
}
