{
  "schema": "envelope/v0.2",
  "msg_id": "x",
  "ts_ns": 0,
  "from": {
    "component": "core",
    "instance": "x"
  },
  "to": {
    "component": "core",
    "instance": "x"
  },
  "session_id": "x",
  "seq": 1,
  "nonce": "x",
  "body": {
    "schema": "surface_event/v0.2",
    "event": "error",
    "data": {
      "surface_id": "x",
      "code": "x",
      "detail": "x"
    }
  }
}
