{
  "schema": "envelope/v0.2",
  "msg_id": "x",
  "ts_ns": 0,
  "from": {
    "component": "core",
    "instance": "x"
  },
  "to": {
    "component": "core",
    "instance": "x"
  },
  "session_id": "x",
  "seq": 1,
  "nonce": "x",
  "body": {
    "op": "show",
    "params": {
      "slot_id": "x"
    },
    "request_id": "x",
    "schema": "ui_intent/v0.2"
  }
}
