{
  "schema": "envelope/v0.2",
  "msg_id": "x",
  "ts_ns": 0,
  "from": {
    "component": "core",
    "instance": "x"
  },
  "to": {
    "component": "core",
    "instance": "x"
  },
  "session_id": "x",
  "seq": 1,
  "nonce": "x",
  "body": {
    "schema": "surface/v0.2",
    "surface_id": "x",
    "kind": "browser",
    "display": "x",
    "geometry": {
      "w": 1,
      "h": 1
    },
    "state": "active",
    "visibility": "folded",
    "control": "agent",
    "profile_id": "x"
  }
}
