{
  "schema": "envelope/v0.2",
  "msg_id": "x",
  "ts_ns": 0,
  "from": {
    "component": "core",
    "instance": "x"
  },
  "to": {
    "component": "core",
    "instance": "x"
  },
  "session_id": "x",
  "seq": 1,
  "nonce": "x",
  "body": {
    "schema": "record_event/v0.2",
    "request_id": "x",
    "surface_id": "x",
    "recording_id": "x",
    "event": "started",
    "mono_ns": 0,
    "mode": "screenshot"
  }
}
