{
  "schema": "envelope/v0.2",
  "msg_id": "x",
  "ts_ns": 0,
  "from": {
    "component": "core",
    "instance": "x"
  },
  "to": {
    "component": "core",
    "instance": "x"
  },
  "session_id": "x",
  "seq": 1,
  "nonce": "x",
  "body": {
    "schema": "action_verdict/v0.2",
    "proposal_id": "x",
    "decision": "refused",
    "reason_code": "STALE_FRAME",
    "core_seq": 1
  }
}
