{
  "schema": "envelope/v0.2",
  "msg_id": "x",
  "ts_ns": 0,
  "from": {
    "component": "core",
    "instance": "x"
  },
  "to": {
    "component": "core",
    "instance": "x"
  },
  "session_id": "x",
  "seq": 1,
  "nonce": "x",
  "body": {
    "schema": "mv_tool_result/v0.2",
    "request_id": "x",
    "op": "list",
    "status": "ok",
    "surfaces": [
      {
        "schema": "surface/v0.1",
        "surface_id": "x",
        "kind": "desktop_capsule",
        "display": "x",
        "geometry": {
          "w": 1,
          "h": 1
        },
        "state": "standby",
        "visibility": "folded",
        "control": "agent",
        "profile_id": "x"
      }
    ],
    "next_cursor": "x"
  }
}
