{
  "schema": "envelope/v0.2",
  "msg_id": "x",
  "ts_ns": 0,
  "from": {
    "component": "core",
    "instance": "x"
  },
  "to": {
    "component": "core",
    "instance": "x"
  },
  "session_id": "x",
  "seq": 1,
  "nonce": "x",
  "body": {
    "op": "exit",
    "params": {
      "exit_code": 0,
      "session_id": "x",
      "signal": null,
      "terminal_generation": 1
    },
    "request_id": "x",
    "schema": "terminal_session/v0.2"
  }
}
