{
  "schema": "envelope/v0.2",
  "msg_id": "x",
  "ts_ns": 0,
  "from": {
    "component": "core",
    "instance": "x"
  },
  "to": {
    "component": "core",
    "instance": "x"
  },
  "session_id": "x",
  "seq": 1,
  "nonce": "x",
  "body": {
    "schema": "record_event/v0.2",
    "request_id": "x",
    "surface_id": "x",
    "recording_id": "x",
    "event": "exported",
    "mono_ns": 0,
    "destination_capability_id": "x",
    "destination_path": "/dev/shm/frame.rgb",
    "sha256": "0000000000000000000000000000000000000000000000000000000000000000",
    "byte_count": 0
  }
}
